{
  "name": "Gretta M9",
  "type": "weapon",
  "img": "icons/weapons/guns/gun-pistol-brown.webp",
  "data": {
    "name": "Gretta M9",
    "description": "Standard firearm of griffin mercenaries, especially Talon Mercs. Reliable and cheap",
    "notes": "",
    "attacks": {
      "sources": {
        "Single": {
          "ap": 4,
          "damage": {
            "base": 1,
            "dice": 2,
            "diceRange": false
          },
          "dtReduction": 0,
          "rounds": 1,
          "splash": "TODO"
        }
      }
    },
    "holdout": true,
    "ranges": {
      "short": {
        "distance": 20,
        "modifier": 0
      },
      "medium": {
        "distance": 40,
        "modifier": -10
      },
      "long": {
        "distance": 60,
        "modifier": -20
      }
    },
    "reload": {
      "ap": 4,
      "caliber": "TODO",
      "containerType": "magazine",
      "size": 12
    },
    "rules": {
      "sources": []
    },
    "skill": "firearms",
    "strengthRequirement": 2,
    "value": 100,
    "weight": 1
  },
  "effects": [],
  "flags": {},
  "_id": "WVweapon00000001"
}
