{
  "name": "Buckscatter M12 \"Grandstallion\"",
  "type": "weapon",
  "img": "icons/weapons/guns/gun-double-barrel.webp",
  "data": {
    "name": "Buckscatter M12 \"Grandstallion\"",
    "description": "A literal boomstick, will deliver a kick to anyone you point it towards.",
    "notes": "",
    "attacks": {
      "sources": {
        "Single": {
          "ap": 4,
          "damage": {
            "base": 1,
            "dice": 7,
            "damageFallOff": "shotgun"
          },
          "rounds": 1
        },
        "Burst": {
          "ap": 5,
          "damage": {
            "base": 2,
            "dice": 10,
            "damageFallOff": "shotgun"
          },
          "rounds": 2
        }
      }
    },
    "ranges": {
      "short": {
        "distance": 12,
        "modifier": 0
      },
      "medium": {
        "distance": 24,
        "modifier": -10
      },
      "long": {
        "distance": 36,
        "modifier": -20
      }
    },
    "reload": {
      "ap": 3,
      "caliber": "shotgunShell",
      "containerType": "internal",
      "size": 2
    },
    "rules": {
      "sources": []
    },
    "skill": "firearms",
    "strengthRequirement": 6,
    "value": 500,
    "weight": 3.5
  },
  "effects": [],
  "flags": {},
  "_id": "WVweapon00000013"
}
